{
  "case_id": "exact_match",
  "tier": "video",
  "evaluator_only": true,
  "label": "synthetic evaluator fixture \u2014 not physical ground truth",
  "provenance": "synthetic_evaluator",
  "rooms": [
    {
      "room_id": "room_0",
      "walls": [
        {
          "wall_id": "room_0_w0",
          "length_m": 4.0,
          "p0_m": [
            0,
            0
          ],
          "p1_m": [
            4,
            0
          ]
        }
      ],
      "openings": [
        {
          "opening_id": "room_0_w0_o0",
          "wall_id": "room_0_w0",
          "width_m": 0.8
        }
      ],
      "ceiling_height_m": 2.5
    }
  ]
}